{"task_id":"TASK-detector-edge-case-regression-tests","verdict":"blocked","summary":"The detector regression test additions appear aligned with the approved task, but the wrapper-provided fd8c8cb3af011d29934f4ed267331368deafb277..HEAD diff still includes extensive unrelated workflow, Telegram, systemd deployment, approval/task metadata, docs, and script changes. Because the handoff says this is a shared-branch/review-base problem that cannot be fixed within the detector-test task without a human/operator decision, the review is blocked.","scope_check":"Blocked: approved scope was limited to detector regression tests and relevant handoff updates. The diff also includes unrelated changes such as deploy/systemd/*, scripts/agent-telegram-bot.py, scripts/idea-worker.py, scripts/agent-autoapprove.sh, scripts/telegram-send.sh, scripts/agent-supervisor.sh, docs/agent-system.md, .agent/telegram.env.example, .gitignore, unrelated approval/task status files, and prior review artifacts. These are outside the approved detector-test task.","tests_check":"The added tests in tests/test_native_detectors.py document deterministic, network-free detector edge cases using existing helper patterns. However, the relevant pytest command was not run; .agent/handoff.md records that pytest/ruff were blocked by an approval gate and only source inspection was performed. Execution remains unverified.","docs_check":"Blocked for scope: .agent/handoff.md documents the detector-test work and the verification blocker, which is relevant. However, docs/agent-system.md and deploy/systemd/README.md add unrelated workflow, Telegram, and always-on operation documentation outside this task.","security_check":"Blocked for scope/security: the diff introduces Telegram integration, notification scripts, auto-approval behavior, systemd service files, and long-running agent supervision. These are notification/deployment/workflow changes and new external-service integration, explicitly forbidden for this detector-test-only task unless separately approved and reviewed in isolation.","required_fixes":["Human/operator action is required to provide a task-scoped review diff limited to tests/test_native_detectors.py and the relevant .agent/handoff.md updates, or otherwise advance/reset the review base so unrelated workflow/Telegram/systemd/script changes are not included in this task review.","After the diff is narrowed, run or have an operator run at minimum pytest tests/test_native_detectors.py -q and record the result or the exact blocker in .agent/handoff.md."],"recommended_followups":["Review the Telegram/systemd/agent workflow changes under separate human-approved tasks with security and deployment scrutiny."]}