{"task_id":"TASK-detector-edge-case-regression-tests","verdict":"blocked","summary":"Review is blocked because the wrapper-provided Task JSON, handoff, diff stat, and git diff are empty. Under the instruction not to run shell or file-inspection commands, I cannot verify the implementation against the approved task.","scope_check":"Blocked: no task contents or diff were provided, so scope cannot be assessed.","tests_check":"Blocked: no diff or test output was provided, so test coverage and execution cannot be assessed.","docs_check":"Blocked: no changed files were provided, so documentation impact cannot be assessed.","security_check":"Blocked: no diff was provided, so security impact cannot be assessed.","required_fixes":["Rerun the review wrapper with populated Task JSON, Handoff, Diff Stat, and Git Diff for fd8c8cb3af011d29934f4ed267331368deafb277..ed3d0a49e1fa98e84c5d462408c4b886007a2f55."],"recommended_followups":[]}