{"task_id":"TASK-docs-setup-verification-audit","verdict":"blocked","summary":"Blocked on branch scope, not README content. The setup, troubleshooting, and verification docs appear to satisfy the approved docs task, but the branch still contains out-of-scope two-agent workflow/script/schema changes that need a human repo-management decision. I could not inspect PR context because gh auth status failed in this sandbox with a bwrap loopback error.","scope_check":"Out of scope for this docs-only task. README and handoff updates are relevant, and app source, frontend source, Docker/deployment files, package metadata, detector logic, and DB schema do not appear to be the problem. The remaining issue is that the branch still includes agent workflow implementation changes such as scripts/agent-loop.sh:395, scripts/agent-task-state.py:26, scripts/materialize-planner-output.py:39, scripts/agent-notify.sh:140, .agent/schemas/task.schema.json:28, docs/agent-system.md:12, and docs/agent-system.md:199.","tests_check":"README.md documents backend, frontend, and Docker verification commands, and .agent/handoff.md records each as not run with a sandbox reason. I did not run pytest, ruff, npm, or Docker during review because this is read-only and those commands can write caches, installs, or build artifacts. The out-of-scope workflow/script changes are not covered by this docs-task verification record.","docs_check":"README.md now covers the normal local setup path, Docker vs non-Docker DB reset, troubleshooting for port conflicts and empty fresh databases, and fastest useful verification commands. However docs/agent-system.md:12 and docs/agent-system.md:199 document bounded loop and GitHub notification behavior outside the approved setup-verification audit.","security_check":"No secrets were observed, and the README keeps the service credential-free. The branch still includes out-of-scope GitHub issue notification behavior via gh at scripts/agent-notify.sh:140, which is external-service workflow behavior and should not be introduced under this docs-only task without separate approval.","required_fixes":["Resolve the branch-scope blocker: narrow this docs task branch so the PR diff is limited to the approved setup/verification/troubleshooting docs and handoff state, or split/approve the agent workflow/script/schema changes in a separate human-approved task/PR. This requires a human/operator decision such as merging the infrastructure base first, retargeting/rebasing the docs branch onto that base, or opening a separate workflow PR."],"recommended_followups":["After the branch is narrowed, run the documented backend, frontend, and Docker verification commands in an environment that permits installs, caches, and builds.","If the bounded revision loop, task-state helper, planner materializer changes, or GitHub notification behavior are desired, review them under a separate approved workflow task with focused tests."]}