{"task_id":"TASK-docs-setup-verification-audit","verdict":"needs_revision","summary":"The README updates largely satisfy the documentation objective, but the task acceptance criterion for recording documented verification commands is not met yet.","scope_check":"README.md documents setup, troubleshooting, and verification without changing application source, frontend source, Docker/deployment files, package metadata, detector logic, or database schema. I could not inspect a PR because gh failed in this sandbox with a bwrap loopback error.","tests_check":"README.md:351-359 lists backend, frontend, and Docker verification commands, but .agent/handoff.md:25-32 only records ruff, pytest, and git as not run. The npm frontend commands and docker compose build are not recorded as run or explicitly not run with reasons, which violates the task acceptance criteria.","docs_check":"README.md:30-45 correctly distinguishes Docker named-volume reset from non-Docker SQLite file reset, README.md:68-74 covers port conflicts, fresh empty readings/events, and stale DB reset, and README.md:351-364 makes the verification block more consistent.","security_check":"No secrets or new API-key-backed automation were introduced in the reviewed README changes. The subscription-first workflow language remains intact.","required_fixes":["Update .agent/handoff.md to record every documented verification command from README.md:351-359, including npm --prefix frontend install, npm --prefix frontend run typecheck, npm --prefix frontend run lint, and docker compose build, as either run successfully or explicitly not run with the reason."],"recommended_followups":["After the handoff is corrected, a reviewer with shell access should run the documented backend, frontend, and Docker verification commands."]}