{"task_id":"TASK-docs-setup-verification-audit","verdict":"needs_revision","summary":"The README setup, troubleshooting, and verification documentation now satisfies the task intent, and the previous handoff gap is fixed. The branch still needs revision because it contains non-doc agent workflow/script changes outside this approved docs-only task.","scope_check":"Not in scope. App source, frontend source, Docker/deployment files, package metadata, detector logic, and DB schema appear unchanged, but the branch includes agent workflow implementation changes such as scripts/agent-loop.sh:395, scripts/agent-task-state.py:26, scripts/materialize-planner-output.py:39, scripts/agent-notify.sh:140, .agent/schemas/task.schema.json:28, and docs/agent-system.md:12. I could not inspect PR context because gh auth status failed in this sandbox with a bwrap loopback error.","tests_check":"README.md:349 documents backend, frontend, and Docker verification commands, and .agent/handoff.md:27 records them as run or explicitly not run with reasons, including npm commands and docker compose build. I did not run pytest, ruff, npm, or Docker commands during review because this review was read-only and those commands can write caches, installs, or build artifacts. The out-of-scope workflow script changes are not covered by the docs-only verification record.","docs_check":"README.md:7, README.md:30, README.md:68, and README.md:349 now clearly cover local setup, Docker vs non-Docker DB reset, troubleshooting, and fastest verification commands. However docs/agent-system.md:12 and docs/agent-system.md:199 document new loop behavior and GitHub notification behavior that are outside the approved setup-verification audit.","security_check":"No secrets were observed, and the README keeps the service credential-free. The out-of-scope scripts include optional GitHub issue creation via gh at scripts/agent-notify.sh:140, which is external-service workflow behavior and should not be introduced under this docs-only task.","required_fixes":["Remove the out-of-scope agent workflow/script/schema changes from this task branch, or split them into a separate human-approved task/PR. This docs-only task should be limited to README/setup-verification/troubleshooting documentation and required handoff state."],"recommended_followups":["After the branch is narrowed, run the documented backend, frontend, and Docker verification commands in an environment that permits them.","If the bounded revision loop, task-state helper, materializer changes, or GitHub notification behavior are desired, review them under a separate approved workflow task with focused tests."]}